headline,url
Mets let one slip away,https://www.mlb.com/mets/news/mets-let-lead-slip-away-in-pivotal-loss-vs-phillies
Philly rout has a playoff feel,https://www.mlb.com/mets/news/mets-belt-four-home-runs-in-rout-of-phillies
VOTE! Lindor named Clemente nominee,https://www.mlb.com/community/roberto-clemente-award?partnerID=robertoclemente_nym_mediawall_2024
Mets Hall of Famer Ed Kranepool passes away,https://www.mlb.com/mets/news/ed-kranepool-dies-at-79
Luisangel Acuña's first Major League hit,https://www.mlb.com/mets/video/luisangel-acuna-singles-on-a-ground-ball-to-center-fielder-cal-stevenson?t=mlb-debuts
Starling Marte's two-run triple,https://www.mlb.com/mets/video/kolby-allard-in-play-run-s-to-starling-marte?t=pennant-chase
Luis Severino strikes out five batters vs. Phillies,https://www.mlb.com/mets/video/luis-severino-strikes-out-five-batters-vs-phillies
Luis Severino's outing against the Phillies,https://www.mlb.com/mets/video/luis-severino-s-outing-against-the-phillies
Field View: Starling Marte's two-run triple,https://www.mlb.com/mets/video/field-view-starling-marte-s-two-run-triple
Mark Vientos scores on an error,https://www.mlb.com/mets/video/kolby-allard-in-play-run-s-to-pete-alonso
Starling Marte's RBI walk,https://www.mlb.com/mets/video/kolby-allard-ball-to-starling-marte-sprc2k
Luis Severino strikes out Trea Turner,https://www.mlb.com/mets/video/trea-turner-strikes-out-swinging-s0xhqi
Breaking down Luis Severino's pitches,https://www.mlb.com/mets/video/breaking-down-luis-severino-s-pitches-x8023
Mets' notable roster moves by David Stearns,https://www.mlb.com/mets/video/mets-notable-roster-moves-by-david-stearns
