headline,url
Mets try to break out brooms,/gameday/716921
150 strikeouts and counting,https://www.mlb.com/mets/news/kodai-senga-records-150th-strikeout-in-win-over-cardinals
Francisco Lindor's four-hit game,https://www.mlb.com/mets/video/francisco-lindor-s-four-hit-game?t=we-got-now
Vogelbach's grand slam (10),https://www.mlb.com/mets/video/daniel-vogelbach-hits-a-grand-slam-10-to-right-center-field-brandon-nimmo?t=mets-homers
Breaking down Daniel Vogelbach's home run,https://www.mlb.com/mets/video/breaking-down-daniel-vogelbach-s-home-run-x0615
Pete Alonso's two-run homer (38),https://www.mlb.com/mets/video/andrew-suarez-in-play-run-s-to-pete-alonso?t=mets-homers
Pete Alonso: Home Run Statcast Analysis,https://www.mlb.com/mets/video/pete-alonso-home-run-statcast-analysis-x0746
DJ Stewart's solo homer (5),https://www.mlb.com/mets/video/dj-stewart-homers-5-on-a-fly-ball-to-right-center-field?t=mets-homers
Measuring the stats on DJ Stewart's home run,https://www.mlb.com/mets/video/measuring-the-stats-on-dj-stewart-s-home-run
Mets vs. Cardinals Highlights,https://www.mlb.com/mets/video/mets-vs-cardinals-highlights-x7504
Kodai Senga's dominant start,https://www.mlb.com/mets/video/kodai-senga-s-dominant-start
Kodai Senga's outing against the Cardinals,https://www.mlb.com/mets/video/kodai-senga-s-outing-against-the-cardinals-x1306
Buck Showalter on the 13-2 win,https://www.mlb.com/mets/video/buck-showalter-on-the-13-2-win
