headline,url
Mets biggest priorities this offseason,https://www.mlb.com/mets/news/mets-priorities-for-2022-2023-offseason
Vote Nimmo for Heart & Hustle Award,https://www.mlb.com/forms/2022-mlbpaa-heart-hustle-award
Keep these prospects on the radar in 2023,https://www.mlb.com/mets/news/mets-prospects-to-watch-in-2023
Watch the Hot Stove every weekday at 9 a.m. ET,https://www.mlb.com/network/shows/hot-stove
Vote Nimmo for Heart & Hustle Award,https://www.mlb.com/forms/2022-mlbpaa-heart-hustle-award
Luke Ritter's solo home run,https://www.mlb.com/mets/video/luke-ritter-s-home-run?t=arizona-fall-league
Vasil on his Fall League start,https://www.mlb.com/mets/video/vasil-on-his-fall-league-start?t=arizona-fall-league
Ronny Mauricio collects two hits,https://www.mlb.com/mets/video/ronny-mauricio-collects-hits
Brandon McIlwain's diving catch,https://www.mlb.com/mets/video/brandon-mcllwain-s-diving-catch?t=arizona-fall-league
Eppler and Showalter on Mets,https://www.mlb.com/mets/video/eppler-and-showalter-on-mets
Mets fall in Wild Card Series,https://www.mlb.com/mets/video/mets-fall-in-wild-card-series?t=beat-report
