headline,url
Carrasco stretches out,/gameday/719154
Senga scratched as Mets in wait-and-see mode,https://www.mlb.com/mets/news/kodai-senga-finger-injury
Bid Now on Mets Game-Used Memorabilia,https://mets.auctions.mlb.com/iSynApp/allAuction.action?sid=1102481&promoGroupList%5b0%5d.strValue1=AMAZINMEM&rc=25
Watch the Hot Stove every weekday at 9 a.m. ET,https://www.mlb.com/network/shows/hot-stove
Ronny Mauricio goes deep to right,https://www.mlb.com/mets/video/ronny-mauricio-goes-deep-to-right
Carrasco K's four batters,https://www.mlb.com/mets/video/carrasco-k-s-four-batters
Marte leaves the game after HBP,https://www.mlb.com/mets/video/marte-leaves-the-game-after-hbp
John Curtiss K's two,https://www.mlb.com/mets/video/john-curtiss-k-s-two
Mark Vientos' RBI single,https://www.mlb.com/mets/video/mark-vientos-rbi-single-x4253
Alex Ramirez's RBI groundout,https://www.mlb.com/mets/video/alex-ramirez-s-rbi-groundout
Stewart's two-run double,https://www.mlb.com/mets/video/stewart-s-two-run-double
Peraza's RBI groundout,https://www.mlb.com/mets/video/peraza-s-rbi-groundout
"Starling Marte's double, homer",https://www.mlb.com/mets/video/starling-marte-s-double-and-homer
