headline,url
'You can't fast forward',https://www.mlb.com/mets/news/mets-expectations-2023-spring-training
All the info about '23 Spring Training for the Mets,https://www.mlb.com/mets/news/mets-spring-training-2023
The top storylines entering Mets Spring Training,https://www.mlb.com/mets/news/mets-biggest-questions-entering-2023-spring-training
How Mets' Opening Day roster might shake out,https://www.mlb.com/mets/news/mets-2023-opening-day-roster
"With McNeil extended, will Alonso be next?",https://www.mlb.com/mets/news/pete-alonso-potential-long-term-contract-framework
Showalter on Mets' expectations,https://www.mlb.com/mets/video/showalter-on-mets-expectations
Verlander throws bullpen session,https://www.mlb.com/mets/video/verlander-throws-bullpen-session
Darling on Mets Spring Training,https://www.mlb.com/mets/video/darling-on-mets-spring-training?t=mlb-network
"Ottavino on re-signing, Classic",https://www.mlb.com/mets/video/ottavino-on-re-signing-classic
Mets take out Super Bowl ad,https://www.mlb.com/mets/video/mets-take-out-super-bowl-ad
Keith Raad joins Mets radio booth,https://www.mlb.com/mets/video/keith-raad-joins-mets-radio-booth
Brandon Nimmo on Spring Training,https://www.mlb.com/mets/video/brandon-nimmo-on-spring-training
Mark Canha on bringing back Nimmo,https://www.mlb.com/mets/video/mark-canha-on-bringing-back-nimmo
