headline,url
'The moments you play for',https://www.mlb.com/mets/news/mets-clinch-2022-playoff-berth
Cookie up next in Milwaukee,/mets/gameday/661159
VOTE! McCann named Clemente nominee,https://www.mlb.com/community/roberto-clemente-award?affiliateId=asb-mediawall-club-2022
Max Scherzer perfect in six,https://www.mlb.com/mets/video/max-scherzer-perfect-in-six?t=key-moments
Mets clinch playoff spot,https://www.mlb.com/mets/video/hunter-renfroe-strikes-out-swinging-awlo9l?t=road-to-the-postseason
Pete Alonso's three-run home run,https://www.mlb.com/mets/video/pete-alonso-s-three-run-home-run?t=mets-homers
Francisco Lindor's RBI triple,https://www.mlb.com/mets/video/francisco-lindor-triples-5-on-a-line-drive-to-right-fielder-hunter-renfro?t=electrified-moments
Daniel Vogelbach's RBI double,https://www.mlb.com/mets/video/corbin-burnes-in-play-run-s-to-daniel-vogelbach-rab8nm?t=road-to-the-postseason
Tomás Nido's RBI single,https://www.mlb.com/mets/video/tomas-nido-singles-on-a-line-drive-to-center-fielder-garrett-mitchell-tyl?t=road-to-the-postseason
Tyler Naquin's RBI single,https://www.mlb.com/mets/video/justin-topa-in-play-run-s-to-tyler-naquin?t=road-to-the-postseason
Pete Alonso's three-run jack (36),https://www.mlb.com/mets/video/pete-alonso-homers-36-on-a-fly-ball-to-left-field-francisco-lindor-scores?t=moonblasts
Max Scherzer earns 200th win,https://www.mlb.com/mets/video/max-scherzer-earns-200th-win
"Lindor, Alonso on playoff clinch",https://www.mlb.com/mets/video/lindor-alonso-on-playoff-clinch
Brandon Nimmo on clinching berth,https://www.mlb.com/mets/video/brandon-nimmo-on-clinching-berth
