headline,url
Mets' rotation possibilities for '24 season,https://www.mlb.com/mets/news/mets-rotation-options-for-2024-season
Diving into Mets' 2024 outfield mix,https://www.mlb.com/mets/news/mets-outfield-options-for-2024
Bid now on game-used Mets memorabilia,https://mets.auctions.mlb.com/iSynApp/allAuction.action?sid=1102481&promoGroupList%5B0%5D.strValue1=AMAZINMEM&rc=25&utm_source=HomePage+NYM&utm_medium=Bullpen+NYM&utm_campaign=NYM+Amazin+Memorabilia+Auction+01_31_24-02_11_24
Edwin Díaz's expectations in 2024,https://www.mlb.com/mets/video/edwin-diaz-s-expectations-in-2024
Mr. and Mrs. Met load truck,https://www.mlb.com/mets/video/mr-and-mrs-met-load-truck
Adam Ottavino returns to Mets,https://www.mlb.com/mets/video/discussing-ottavino-and--mets
Lindor accepts Toast of the Town,https://www.mlb.com/mets/video/lindor-accepts-toast-of-the-town
Edwin Díaz throws bullpen session,https://www.mlb.com/mets/video/edwin-diaz-throws-bullpen-session
Olerud and Alfonzo honored,https://www.mlb.com/mets/video/olerud-and-alfonzo-honored
Adam Ottavino wins Good Guy Award,https://www.mlb.com/mets/video/ottavino-bbwaa-good-guy-award
Top 10 Left Fielders: #2,https://www.mlb.com/mets/video/top-10-left-fielders-2-x1614?t=mlb-network
Jeff McNeil's offseason mindset,https://www.mlb.com/mets/video/jeff-mcneil-s-offseason-mindset?t=mlb-network
David Wright's greatest moments,https://www.mlb.com/mets/video/david-wright-s-greatest-moments
Strawberry on number retirement,https://www.mlb.com/mets/video/strawberry-on-number-retirement
"Doc, Straw to have numbers retired",https://www.mlb.com/mets/video/doc-straw-to-have-numbers-retired
