headline,url
Mets biggest priorities this offseason,https://www.mlb.com/mets/news/mets-priorities-for-2022-2023-offseason
Keep these prospects on the radar in 2023,https://www.mlb.com/mets/news/mets-prospects-to-watch-in-2023
Mets release 2023 schedule,https://www.mlb.com/mets/schedule/2023-03
Luke Ritter's solo home run,https://www.mlb.com/mets/video/luke-ritter-s-home-run?t=arizona-fall-league
Vasil on his Fall League start,https://www.mlb.com/mets/video/vasil-on-his-fall-league-start?t=arizona-fall-league
Ronny Mauricio collects two hits,https://www.mlb.com/mets/video/ronny-mauricio-collects-hits
Brandon McIlwain's diving catch,https://www.mlb.com/mets/video/brandon-mcllwain-s-diving-catch?t=arizona-fall-league
Eppler and Showalter on Mets,https://www.mlb.com/mets/video/eppler-and-showalter-on-mets
"Bassitt, Showalter on loss",https://www.mlb.com/mets/video/bassitt-showalter-on-loss?t=nl-wild-card-b
Mets fall in Wild Card Series,https://www.mlb.com/mets/video/mets-fall-in-wild-card-series?t=beat-report
Jacob deGrom on future with Mets,https://www.mlb.com/mets/video/jacob-degrom-on-future-with-mets?t=nl-wild-card-b
Showalter on NL Wild Card loss,https://www.mlb.com/mets/video/showalter-on-nl-wild-card-loss?t=nl-wild-card-b
