headline,url
New York not discouraged by Draft Lottery draw,https://www.mlb.com/mets/news/mets-land-19th-overall-pick-in-mlb-draft-lottery
Leaning on in-house talent at the hot corner in '24,https://www.mlb.com/mets/news/brett-baty-ronny-mauricio-to-compete-for-mets-2024-third-base-role
Mets gear up for Meetings with focus on arms,https://www.mlb.com/mets/news/mets-2023-winter-meetings-goals
David Stearns joins MLB Tonight,https://www.mlb.com/mets/video/david-stearns-join-mlb-tonight?t=winter-meetings
Going for Yamamoto and more,https://www.mlb.com/mets/video/going-for-yamamoto-and-more?t=winter-meetings
"Mendoza on Severino, Díaz",https://www.mlb.com/mets/video/mendoza-on-severino-diaz?t=winter-meetings
Mendoza on new role with Mets,https://www.mlb.com/mets/video/mendoza-on-new-role-with-mets?t=winter-meetings
Luis Severino inks deal with Mets,https://www.mlb.com/mets/video/luis-severino-inks-deal-with-mets
Mets sign infielder Joey Wendle,https://www.mlb.com/mets/video/mets-to-sign-joey-wendle?t=trade-talk
Mets host annual turkey giveaway,https://www.mlb.com/mets/video/mets-host-annual-turkey-giveaway
Mets’ best catches of 2023,https://www.mlb.com/mets/video/mets-best-catches-of-2023?t=statcast
Mets introduce Carlos Mendoza,https://www.mlb.com/mets/video/mets-introduce-carlos-mendoza?t=trade-talk
"Howie Rose on Mendoza, Mets",https://www.mlb.com/mets/video/howie-rose-on-mendoza-mets
Kodai Senga places 2nd for NL ROY,https://www.mlb.com/mets/video/kodai-senga-places-2nd-for-nl-roy?t=awards-watch
