headline,url
What will the Mets do after Yamamoto chooses?,https://www.mlb.com/mets/news/breaking-down-mets-plan-after-yoshinobu-yamamoto
Lindor earns All-MLB Second Team honors again,https://www.mlb.com/mets/news/francisco-lindor-all-mlb-second-team-2023
Mauricio's 'upsetting' injury sparks questions,https://www.mlb.com/mets/news/mets-infield-depth-after-ronny-mauricio-injury
Mets' Top 5 OF assists of 2023,https://www.mlb.com/mets/video/mets-top-5-of-assists-of-2023?t=statcast
2023 All-MLB 2nd Team: Lindor,https://www.mlb.com/mets/video/2023-all-mlb-2nd-team-lindor?t=all-mlb-team
Gibbons on being Mets bench coach,https://www.mlb.com/mets/video/gibbons-on-being-mets-bench-coach
Prime 9: Tom Seaver,https://www.mlb.com/mets/video/prime-9-tom-seaver-x9146
"DiComo on Mauricio's injury, more",https://www.mlb.com/mets/video/dicomo-on-mets-offseason?t=mlb-network
Mets’ Hardest Hits of 2023,https://www.mlb.com/mets/video/mets-hardest-hits-of-2023
Prime 9: Gary Carter,https://www.mlb.com/mets/video/prime-9-gary-carter-x7788
Stearns on Mets' offseason plans,https://www.mlb.com/mets/video/david-stearns-join-mlb-tonight?t=winter-meetings
Going for Yamamoto and more,https://www.mlb.com/mets/video/going-for-yamamoto-and-more?t=winter-meetings
"Mendoza on Severino, Díaz",https://www.mlb.com/mets/video/mendoza-on-severino-diaz?t=winter-meetings
Mendoza on new role with Mets,https://www.mlb.com/mets/video/mendoza-on-new-role-with-mets?t=winter-meetings
