headline,url
Last orders in London,https://www.mlb.com/stories/game-preview/745571
VOTE! Help make Mets All-Star Game starters,https://www.mlb.com/all-star/ballot?affiliateId=asb-mediawall-club-2024
Wright chats with fans from across pond,https://www.mlb.com/video/chatting-practice-david-wright-110524?t=chatting-practice
Things get wonky for Mets,https://www.mlb.com/mets/news/starling-marte-s-misplay-costs-mets-in-london-series-opener
Starling Marte's RBI double,https://www.mlb.com/mets/video/starling-marte-doubles-8-on-a-sharp-line-drive-to-left-fielder-whit-merri?t=london-series
Sean Manaea gets Bryson Stott looking,https://www.mlb.com/mets/video/bryson-stott-called-out-on-strikes-tl1o1d?t=london-series
Carlos Mendoza on loss in London Series opener,https://www.mlb.com/mets/video/carlos-mendoza-on-loss-in-london-series-opener?t=london-series
Jose Quintana on starting Game 2 in London,https://www.mlb.com/mets/video/jose-quintana-on-starting-game-two-in-london?t=london-series
J.D. Martinez's RBI groundout,https://www.mlb.com/mets/video/ranger-suarez-in-play-run-s-to-j-d-martinez-ublikk?t=london-series
Harrison Bader gets mic'd up in London,https://www.mlb.com/mets/video/harrison-bader-gets-mic-d-up-in-london?t=london-series
Luis Torrens catches Bryce Harper stealing,https://www.mlb.com/mets/video/luis-torrens-catches-bryce-harper-stealing?t=london-series
Francisco Lindor's double in the 1st inning,https://www.mlb.com/mets/video/francisco-lindor-doubles-15-on-a-sharp-line-drive-to-left-fielder-whit-me?t=london-series
Chatting Practice: David Wright,https://www.mlb.com/mets/video/chatting-practice-david-wright-110524?t=chatting-practice
Luis Torrens' two-homer game,https://www.mlb.com/mets/video/luis-torrens-two-home-run-game?t=key-moments
