headline,url
Nimmo leaps Mets past LA,https://www.mlb.com/mets/news/brandon-nimmo-robs-justin-turner-of-a-home-run
Bassitt wraps series vs. LA,/mets/gameday/662410
Mets release 2023 schedule,https://www.mlb.com/mets/schedule/2023-03
Nimmo robs Turner of a home run,https://www.mlb.com/mets/video/brandon-nimmo-s-leaping-grab?t=catch-of-the-day
Brandon Nimmo on clutch catch,https://www.mlb.com/mets/video/brandon-nimmo-on-clutch-catch
Starling Marte's two-run homer (16),https://www.mlb.com/mets/video/starling-marte-homers-16-on-a-fly-ball-to-center-field-brandon-nimmo-scor?t=mets-homers
Jacob deGrom fans nine,https://www.mlb.com/mets/video/jacob-degrom-fans-nine?t=pinpoint-accuracy
Edwin Díaz seals the win,https://www.mlb.com/mets/video/lad-nym-a30804?t=clutch-moments
Brandon Nimmo's leaping catch,https://www.mlb.com/mets/video/brandon-nimmo-s-leaping-grab-x2046?t=major-league-vibes
Adam Ottavino K's Mookie Betts,https://www.mlb.com/mets/video/mookie-betts-strikes-out-swinging-sdy0gf
Jeff McNeil talks about hitting,https://www.mlb.com/mets/video/jeff-mcneil-talks-about-hitting?t=mlb-network
Mets' plans for Jacob deGrom,https://www.mlb.com/mets/video/mets-plans-for-jacob-degrom?t=mlb-network
Buck Showalter on Mets' success,https://www.mlb.com/mets/video/buck-showalter-on-mets-success?t=mlb-network
Timmy Trumpet on first pitch,https://www.mlb.com/mets/video/timmy-trumpet-on-first-pitch?t=major-league-vibes
