headline,url
Lindor HRs on Clemente Day,https://stories.mlb.com/live/662398.html
Mets unable to solve Cubs,https://www.mlb.com/mets/news/mets-swept-in-three-game-series-for-first-time-in-2022
VOTE! McCann named Clemente nominee,https://www.mlb.com/community/roberto-clemente-award?affiliateId=asb-mediawall-club-2022
Food fight! Which ballpark bite is best?,https://www.mlb.com/brackets/food-fight?affiliateId=ffb-mediawall-club-2022
Lindor's two-run homer (24),https://www.mlb.com/mets/video/francisco-lindor-homers-24-on-a-fly-ball-to-right-field-brandon-nimmo-sco?t=mets-homers
Roberto Clemente Day ceremony,https://www.mlb.com/mets/video/roberto-clemente-ceremony?t=roberto-clemente-award
Daniel Vogelbach's two-run double,https://www.mlb.com/mets/video/daniel-vogelbach-s-two-run-double
Clemente's son throws first pitch,https://www.mlb.com/mets/video/clemente-s-son-throws-first-pitch?t=roberto-clemente-award
Mark Vientos' first career hit,https://www.mlb.com/mets/video/mark-vientos-first-career-hit
Tim Britton on Mets' stretch run,https://www.mlb.com/mets/video/tim-britton-on-mets-stretch-run?t=mlb-network
Pete Alonso's 35th home run,https://www.mlb.com/mets/video/pete-alonso-homers-35-on-a-line-drive-to-center-field?t=mets-homers
Francisco Lindor's great throw,https://www.mlb.com/mets/video/alex-claudio-in-play-out-s-to-david-bote?t=top-defensive-plays
Tomás Nido's solo homer (2),https://www.mlb.com/mets/video/tomas-nido-homers-2-on-a-fly-ball-to-center-field-9p9wij?t=mets-homers
Francisco Lindor on Mets' offense,https://www.mlb.com/mets/video/francisco-lindor-on-mets-offense
