headline,url
"Flashing lights, new heights",https://www.mlb.com/mets/news/mets-upgrading-player-introductions-scoreboard-graphics
Will 2023 bring the return of Joey Fuego?,https://www.mlb.com/mets/news/joey-lucchesi-bouncing-back-after-tommy-john-surgery
Mets' spring slate gets going,/mets/gameday/719391
Beltrán: 'This organization is part of who I am',https://www.mlb.com/mets/news/carlos-beltran-on-role-in-mets-front-office
Can Alonso reclaim NYC power crown -- again?,https://www.mlb.com/mets/news/pete-alonso-targeting-aaron-judge-home-run-mark
Spring Training Sprint: Alonso,https://www.mlb.com/mets/video/spring-training-sprint-alonso?t=mlb-network
DiComo on Mets' capabilities,https://www.mlb.com/mets/video/dicomo-on-mets-capabilities?t=mlb-network
"Showalter on camp, new faces",https://www.mlb.com/mets/video/showalter-on-camp-new-faces?t=mlb-network
Mets' rotation in 2023,https://www.mlb.com/mets/video/mets-rotation-in-2023?t=mlb-network
Carlos Beltran on Mets role,https://www.mlb.com/mets/video/carlos-beltran-on-mets-role
Spring Training Sprint: McNeil,https://www.mlb.com/mets/video/spring-training-sprint-mcneil?t=mlb-network
Jim Callis on top Mets prospects,https://www.mlb.com/mets/video/jim-callis-on-top-mets-prospects?t=mlb-network
Flores and Floyd preview the Mets,https://www.mlb.com/mets/video/flores-and-floyd-preview-the-mets?t=mlb-network
