headline,url
"Pete, Lindor finalists for Silver Slugger hardware",https://www.mlb.com/news/silver-slugger-award-finalists-2023
Mets gearing up for busy winter ahead,https://www.mlb.com/mets/news/mets-offseason-faq-2023
Vote Nimmo for Heart & Hustle Award,https://www.mlb.com/forms/2023-mlbpaa-heart-hustle-award
Vote Brandon Nimmo for Heart & Hustle Award,https://www.mlb.com/forms/2023-mlbpaa-heart-hustle-award
JT Schwartz's amazing grab,https://www.mlb.com/mets/video/jt-schwartz-s-amazing-grab?t=arizona-fall-league
David Stearns on new role,https://www.mlb.com/mets/video/mets-introduce-david-stearns-x1294
Mets introduce David Stearns,https://www.mlb.com/mets/video/mets-introduce-david-stearns
Buck Showalter gets an ovation,https://www.mlb.com/mets/video/buck-showalter-gets-an-ovation
