headline,url
Beltrán: 'This organization is part of who I am',https://www.mlb.com/mets/news/carlos-beltran-on-role-in-mets-front-office
Can Alonso reclaim NYC power crown -- again?,https://www.mlb.com/mets/news/pete-alonso-targeting-aaron-judge-home-run-mark
The latest from Clover Park,https://www.mlb.com/mets/news/billy-eppler-discusses-mets-payroll
"'When I do something, I don't do it halfway'",https://www.mlb.com/mets/news/steve-cohen-discusses-mets-offseason-moves
"You see it, then you don't",https://www.mlb.com/mets/news/kodai-senga-ghost-fork-pitch
David Robertson on spring camp,https://www.mlb.com/mets/video/david-robertson-on-spring-camp
Robertson has fun with 4K camera,https://www.mlb.com/mets/video/robertson-has-fun-with-4k-camera
Cohen discusses Mets' season,https://www.mlb.com/mets/video/cohen-discusses-mets-season
Mets' Spring Training progress,https://www.mlb.com/mets/video/mets-spring-training-progress
Mark Canha on his season goals,https://www.mlb.com/mets/video/mark-canha-on-his-season-goals?t=spring-training
Peterson on learning every season,https://www.mlb.com/mets/video/peterson-on-learning-every-season?t=spring-training
Billy Eppler on Spring Training,https://www.mlb.com/mets/video/billy-eppler-on-spring-training?t=spring-training
