headline,url
Mets continue set vs. Pirates,/mets/gameday/662404
'He’s just been a rock for us',https://www.mlb.com/mets/news/francisco-lindor-homers-on-roberto-clemente-day
VOTE! McCann named Clemente nominee,https://www.mlb.com/community/roberto-clemente-award?affiliateId=asb-mediawall-club-2022
Food fight! Which ballpark bite is best?,https://www.mlb.com/brackets/food-fight?affiliateId=ffb-mediawall-club-2022
Lindor's two-run homer (24),https://www.mlb.com/mets/video/francisco-lindor-homers-24-on-a-fly-ball-to-right-field-brandon-nimmo-sco?t=mets-homers
Daniel Vogelbach's two-run double,https://www.mlb.com/mets/video/daniel-vogelbach-s-two-run-double
Francisco Lindor on Clemente Day,https://www.mlb.com/mets/video/francisco-lindor-on-clemente-day
Carlos Carrasco K's 11,https://www.mlb.com/mets/video/carlos-carrasco-k-s-11?t=pinpoint-accuracy
Pirates vs. Mets Highlights,https://www.mlb.com/mets/video/pirates-vs-mets-highlights-x3670
Roberto Clemente Day ceremony,https://www.mlb.com/mets/video/roberto-clemente-ceremony?t=roberto-clemente-award
Buck Showalter on 7-1 win,https://www.mlb.com/mets/video/buck-showalter-on-7-1-win
Mark Vientos' first career hit,https://www.mlb.com/mets/video/mark-vientos-first-career-hit
Mark Vientos on first MLB hit,https://www.mlb.com/mets/video/mark-vientos-on-first-mlb-hit
Francisco Lindor Mic'd Up,https://www.mlb.com/mets/video/francisco-lindor-mic-d-up-x7864
Clemente's son throws first pitch,https://www.mlb.com/mets/video/clemente-s-son-throws-first-pitch?t=roberto-clemente-award
