headline,url
Bader delivers against Bucs,https://www.mlb.com/mets/news/harrison-bader-helps-mets-rally-past-pirates
Mets seeking series victory,https://www.mlb.com/stories/game-preview/745837
Rachel Robinson visits Mets at Citi Field,https://www.mlb.com/mets/video/rachel-robinson-visits-mets-at-citi-field
DJ Stewart's game-tying RBI double,https://www.mlb.com/mets/video/dj-stewart-doubles-2-on-a-line-drive-to-right-fielder-connor-joe-brett-ba
Rachel Robinson receives flowers at Citi Field,https://www.mlb.com/mets/video/rachel-robinson-receives-flowers-at-citi-field?t=jackie-robinson-day
Jeff McNeil's sacrifice fly,https://www.mlb.com/mets/video/martin-perez-in-play-run-s-to-jeff-mcneil-jp3zuw
Francisco Alvarez's RBI walk,https://www.mlb.com/mets/video/martin-perez-ball-to-francisco-alvarez-36df9b
David Robinson on the impact and legacy of his father,https://www.mlb.com/mets/video/david-robinson-on-the-impact-and-legacy-of-his-father
Pete Alonso is named NL Player of the Week,https://www.mlb.com/mets/video/pete-alonso-is-named-nl-player-of-the-week?t=players-of-the-week
The Mets retire number 16 for Dwight Gooden,https://www.mlb.com/mets/video/the-mets-retire-number-16-for-dwight-gooden
