headline,url
Early? No. Right on time,/mets/gameday/662442
Mets release 2023 schedule,https://www.mlb.com/mets/schedule/2023-03
Alonso walks it off,https://www.mlb.com/mets/news/mets-walk-off-in-win-vs-rockies
Mets retire Willie Mays' No. 24,https://www.mlb.com/mets/video/mets-retire-willie-mays-no-24
Valentine rocks the fake stache,https://www.mlb.com/mets/video/valentine-rocks-the-fake-stache
Mets Old Timers’ Day,https://www.mlb.com/mets/video/mets-old-timers-day-35142
Pete Alonso's game-winning RBI,https://www.mlb.com/mets/video/pete-alonso-singles-on-a-ground-ball-to-left-fielder-sam-hilliard-brandon-nimmo?t=walk-off
Pete Alonso talks walk-off win,https://www.mlb.com/mets/video/pete-alonso-talks-walk-off-win
Mets' late-game heroics,https://www.mlb.com/mets/video/mets-late-game-heroics
Starling Marte's two-run triple,https://www.mlb.com/mets/video/chad-kuhl-in-play-run-s-to-starling-marte?t=electrified-moments
Mark Canha's two-run double,https://www.mlb.com/mets/video/mark-canha-doubles-18-on-a-ground-ball-to-left-fielder-sam-hilliard-darin?t=clutch-moments
Brett Baty's solo home run (2),https://www.mlb.com/mets/video/col-nym-62ff13?t=mets-homers
Rockies vs. Mets Highlights,https://www.mlb.com/mets/video/rockies-vs-mets-highlights-x0591
