headline,url
Mets' offense erupts vs. Nats,https://www.mlb.com/mets/news/mets-9-run-inning-leads-to-rout-of-nationals
VOTE! Lindor named Clemente nominee,https://www.mlb.com/community/roberto-clemente-award?partnerID=robertoclemente_nym_mediawall_2024
Rotation continues to roll,https://www.mlb.com/mets/news/tylor-megill-shines-as-mets-increase-wild-card-lead
"Two bucket list trips, one winner",https://www.wm.com/us/en/cpn/will-it-recycle/mlb?cmp=DIS-MLB-MLB_WIR-ALL-MKTG-MLBDigital-V1-Link-Additional_Digital
Mets' nine-run fourth inning,https://www.mlb.com/mets/video/mets-nine-run-4th-inning?t=pennant-chase
Brandon Nimmo's three-run home run (20),https://www.mlb.com/mets/video/brandon-nimmo-homers-20-on-a-fly-ball-to-right-center-field-jose-iglesias?t=clutch-moments
Breaking down Brandon Nimmo's home run,https://www.mlb.com/mets/video/breaking-down-brandon-nimmo-s-home-run-x2115
Luisangel Acuña's solo home run (2),https://www.mlb.com/mets/video/luisangel-acuna-homers-2-on-a-fly-ball-to-left-field?t=pennant-chase
Tyrone Taylor's sensational catch,https://www.mlb.com/mets/video/andres-chaparro-flies-out-to-right-fielder-tyrone-taylor?t=cap-off-plays
Mark Vientos' two-run single,https://www.mlb.com/mets/video/dj-herz-in-play-run-s-to-mark-vientos?t=pennant-chase
Jose Quintana twirls gem vs. Nationals,https://www.mlb.com/mets/video/jose-quintana-twirls-gem-vs-nationals
Tyrone Taylor's RBI double,https://www.mlb.com/mets/video/tyrone-taylor-doubles-21-on-a-line-drive-to-center-fielder-jacob-young-br
Starling Marte's two-run single,https://www.mlb.com/mets/video/jacob-barnes-in-play-run-s-to-starling-marte-lvkjh9?t=pennant-chase
Luisangel Acuña's run-scoring knock,https://www.mlb.com/mets/video/dj-herz-in-play-run-s-to-luisangel-acuna
A deep dive into Brandon Nimmo's home run,https://www.mlb.com/mets/video/a-deep-dive-into-brandon-nimmo-s-home-run-x1926
