headline,url
Lindor 'fully on board' with painful '23 behind him,https://www.mlb.com/mets/news/francisco-lindor-discusses-playing-through-injury-2024-goals
'I plan to be ready for anything that comes',https://www.mlb.com/mets/news/kodai-senga-opens-season-as-ace-of-mets-staff
What's in store for the Mets this season?,https://www.mlb.com/mets/news/mets-spring-training-storylines-2024
Predicting the Mets' 2024 Opening Day roster,https://www.mlb.com/mets/news/mets-2024-opening-day-roster
Sean Manaea on first Spring Training with the Mets,https://www.mlb.com/mets/video/sean-manaea-on-first-spring-training-with-the-mets?t=spring-training
David Stearns on Pete Alonso's upcoming free agency,https://www.mlb.com/mets/video/david-stearns-on-pete-alonso-s-upcoming-free-agency?t=spring-training
Carlos Mendoza talks Spring Training,https://www.mlb.com/mets/video/carlos-mendoza-talks-spring-training?t=spring-training
"David Stearns talks Spring Training, players, more",https://www.mlb.com/mets/video/david-stearns-talks-spring-training-players-more?t=spring-training
Discussing the Mets' outlook for the 2024 season,https://www.mlb.com/mets/video/discussing-the-mets-outlook-for-the-2024-season?t=mlb-tonight
DJ Stewart on giving back to fans,https://www.mlb.com/mets/video/dj-stewart-on-giving-back-to-fans
Kodai Senga plays catch at Mets camp,https://www.mlb.com/mets/video/kodai-senga-plays-catch-at-mets-camp?t=spring-training
"Adrian Houser on trade to Mets, goals for 2024 season",https://www.mlb.com/mets/video/adrian-houser-on-trade-to-mets-goals-for-2024-season?t=spring-training
"Edwin Díaz's thoughts on Spring Training, health",https://www.mlb.com/mets/video/edwin-diaz-s-thoughts-on-spring-training-health?t=spring-training
"Francisco Lindor talks goals for 2024, more",https://www.mlb.com/mets/video/francisco-lindor-talks-goals-for-2024-more?t=spring-training
